<?xml version="1.0" encoding="UTF-8"?>
<Type_0xcb messageNo="0" messageSequenceNo="0"
	messageSerialNo="0" xmlns="http://www.example.org/msg_0xcb" xmlns:u="http://www.example.org/UType"
	xmlns:xsi="http://www.w3.org/2001/XMLSchema-instance"
	xsi:schemaLocation="http://www.example.org/msg_0xcb ../xsd/msg_0xcb.xsd ">
	<Trigger_HostListID>0</Trigger_HostListID>
	<Trigger_Hosts>
		<Trigger_Host>
			<HostName>HostName</HostName>
		</Trigger_Host>
		<Trigger_Host>
			<HostName>HostName</HostName>
		</Trigger_Host>
		<Trigger_Host>
			<HostName>HostName</HostName>
		</Trigger_Host>
	</Trigger_Hosts>
</Type_0xcb>
